# 2008 December 11
#
# The author disclaims copyright to this source code.  In place of
# a legal notice, here is a blessing:
#
#    May you do good and not evil.
#    May you find forgiveness for yourself and forgive others.
#    May you share freely, never taking more than you give.
#
#***********************************************************************
# This file implements regression tests for SQLite library.
#
# This file is automatically generated from a separate TCL script.
# This file seeks to exercise integer boundary values.
#
# $Id: boundary4.test,v 1.2 2009/01/02 15:45:48 shane Exp $

set testdir [file dirname $argv0]
source $testdir/tester.tcl

# Many of the boundary tests depend on a working 64-bit implementation.
if {![working_64bit_int]} { finish_test; return }
ifcapable !altertable     { finish_test; return }

do_test boundary4-1.1 {
  db eval {
    CREATE TABLE t1(a,x);
    INSERT INTO t1(oid,a,x) VALUES(549755813887,1,'0000007fffffffff');
    INSERT INTO t1(oid,a,x) VALUES(-8388608,2,'ffffffffff800000');
    INSERT INTO t1(oid,a,x) VALUES(0,3,'0000000000000000');
    INSERT INTO t1(oid,a,x) VALUES(-129,4,'ffffffffffffff7f');
    INSERT INTO t1(oid,a,x) VALUES(8388608,5,'0000000000800000');
    INSERT INTO t1(oid,a,x) VALUES(65535,6,'000000000000ffff');
    INSERT INTO t1(oid,a,x) VALUES(8388607,7,'00000000007fffff');
    INSERT INTO t1(oid,a,x) VALUES(1099511627776,8,'0000010000000000');
    INSERT INTO t1(oid,a,x) VALUES(16777215,9,'0000000000ffffff');
    INSERT INTO t1(oid,a,x) VALUES(32767,10,'0000000000007fff');
    INSERT INTO t1(oid,a,x) VALUES(4294967296,11,'0000000100000000');
    INSERT INTO t1(oid,a,x) VALUES(-549755813888,12,'ffffff8000000000');
    INSERT INTO t1(oid,a,x) VALUES(-140737488355328,13,'ffff800000000000');
    INSERT INTO t1(oid,a,x) VALUES(256,14,'0000000000000100');
    INSERT INTO t1(oid,a,x) VALUES(16777216,15,'0000000001000000');
    INSERT INTO t1(oid,a,x) VALUES(72057594037927936,16,'0100000000000000');
    INSERT INTO t1(oid,a,x) VALUES(-1,17,'ffffffffffffffff');
    INSERT INTO t1(oid,a,x) VALUES(9223372036854775807,18,'7fffffffffffffff');
    INSERT INTO t1(oid,a,x) VALUES(281474976710655,19,'0000ffffffffffff');
    INSERT INTO t1(oid,a,x) VALUES(1099511627775,20,'000000ffffffffff');
    INSERT INTO t1(oid,a,x) VALUES(-8388609,21,'ffffffffff7fffff');
    INSERT INTO t1(oid,a,x) VALUES(32768,22,'0000000000008000');
    INSERT INTO t1(oid,a,x) VALUES(36028797018963968,23,'0080000000000000');
    INSERT INTO t1(oid,a,x) VALUES(-32769,24,'ffffffffffff7fff');
    INSERT INTO t1(oid,a,x) VALUES(127,25,'000000000000007f');
    INSERT INTO t1(oid,a,x) VALUES(-9223372036854775808,26,'8000000000000000');
    INSERT INTO t1(oid,a,x) VALUES(72057594037927935,27,'00ffffffffffffff');
    INSERT INTO t1(oid,a,x) VALUES(-549755813889,28,'ffffff7fffffffff');
    INSERT INTO t1(oid,a,x) VALUES(255,29,'00000000000000ff');
    INSERT INTO t1(oid,a,x) VALUES(-36028797018963969,30,'ff7fffffffffffff');
    INSERT INTO t1(oid,a,x) VALUES(-2147483648,31,'ffffffff80000000');
    INSERT INTO t1(oid,a,x) VALUES(281474976710656,32,'0001000000000000');
    INSERT INTO t1(oid,a,x) VALUES(65536,33,'0000000000010000');
    INSERT INTO t1(oid,a,x) VALUES(140737488355328,34,'0000800000000000');
    INSERT INTO t1(oid,a,x) VALUES(549755813888,35,'0000008000000000');
    INSERT INTO t1(oid,a,x) VALUES(2147483648,36,'0000000080000000');
    INSERT INTO t1(oid,a,x) VALUES(4294967295,37,'00000000ffffffff');
    INSERT INTO t1(oid,a,x) VALUES(140737488355327,38,'00007fffffffffff');
    INSERT INTO t1(oid,a,x) VALUES(-2147483649,39,'ffffffff7fffffff');
    INSERT INTO t1(oid,a,x) VALUES(36028797018963967,40,'007fffffffffffff');
    INSERT INTO t1(oid,a,x) VALUES(128,41,'0000000000000080');
    INSERT INTO t1(oid,a,x) VALUES(-32768,42,'ffffffffffff8000');
    INSERT INTO t1(oid,a,x) VALUES(-36028797018963968,43,'ff80000000000000');
    INSERT INTO t1(oid,a,x) VALUES(-140737488355329,44,'ffff7fffffffffff');
    INSERT INTO t1(oid,a,x) VALUES(-128,45,'ffffffffffffff80');
    INSERT INTO t1(oid,a,x) VALUES(2147483647,46,'000000007fffffff');
    CREATE INDEX t1i1 ON t1(a);
    CREATE INDEX t1i2 ON t1(x);
  }
} {}
do_test boundary4-1.2 {
  db eval {
    SELECT count(*) FROM t1
  }
} {46}
do_test boundary4-1.3 {
  db eval {
    SELECT rowid, a, x FROM t1 ORDER BY +rowid
  }
} {-9223372036854775808 26 8000000000000000 -36028797018963969 30 ff7fffffffffffff -36028797018963968 43 ff80000000000000 -140737488355329 44 ffff7fffffffffff -140737488355328 13 ffff800000000000 -549755813889 28 ffffff7fffffffff -549755813888 12 ffffff8000000000 -2147483649 39 ffffffff7fffffff -2147483648 31 ffffffff80000000 -8388609 21 ffffffffff7fffff -8388608 2 ffffffffff800000 -32769 24 ffffffffffff7fff -32768 42 ffffffffffff8000 -129 4 ffffffffffffff7f -128 45 ffffffffffffff80 -1 17 ffffffffffffffff 0 3 0000000000000000 127 25 000000000000007f 128 41 0000000000000080 255 29 00000000000000ff 256 14 0000000000000100 32767 10 0000000000007fff 32768 22 0000000000008000 65535 6 000000000000ffff 65536 33 0000000000010000 8388607 7 00000000007fffff 8388608 5 0000000000800000 16777215 9 0000000000ffffff 16777216 15 0000000001000000 2147483647 46 000000007fffffff 2147483648 36 0000000080000000 4294967295 37 00000000ffffffff 4294967296 11 0000000100000000 549755813887 1 0000007fffffffff 549755813888 35 0000008000000000 1099511627775 20 000000ffffffffff 1099511627776 8 0000010000000000 140737488355327 38 00007fffffffffff 140737488355328 34 0000800000000000 281474976710655 19 0000ffffffffffff 281474976710656 32 0001000000000000 36028797018963967 40 007fffffffffffff 36028797018963968 23 0080000000000000 72057594037927935 27 00ffffffffffffff 72057594037927936 16 0100000000000000 9223372036854775807 18 7fffffffffffffff}
do_test boundary4-1.4 {
  db eval {
    SELECT rowid, a, x FROM t1 ORDER BY rowid
  }
} {-9223372036854775808 26 8000000000000000 -36028797018963969 30 ff7fffffffffffff -36028797018963968 43 ff80000000000000 -140737488355329 44 ffff7fffffffffff -140737488355328 13 ffff800000000000 -549755813889 28 ffffff7fffffffff -549755813888 12 ffffff8000000000 -2147483649 39 ffffffff7fffffff -2147483648 31 ffffffff80000000 -8388609 21 ffffffffff7fffff -8388608 2 ffffffffff800000 -32769 24 ffffffffffff7fff -32768 42 ffffffffffff8000 -129 4 ffffffffffffff7f -128 45 ffffffffffffff80 -1 17 ffffffffffffffff 0 3 0000000000000000 127 25 000000000000007f 128 41 0000000000000080 255 29 00000000000000ff 256 14 0000000000000100 32767 10 0000000000007fff 32768 22 0000000000008000 65535 6 000000000000ffff 65536 33 0000000000010000 8388607 7 00000000007fffff 8388608 5 0000000000800000 16777215 9 0000000000ffffff 16777216 15 0000000001000000 2147483647 46 000000007fffffff 2147483648 36 0000000080000000 4294967295 37 00000000ffffffff 4294967296 11 0000000100000000 549755813887 1 0000007fffffffff 549755813888 35 0000008000000000 1099511627775 20 000000ffffffffff 1099511627776 8 0000010000000000 140737488355327 38 00007fffffffffff 140737488355328 34 0000800000000000 281474976710655 19 0000ffffffffffff 281474976710656 32 0001000000000000 36028797018963967 40 007fffffffffffff 36028797018963968 23 0080000000000000 72057594037927935 27 00ffffffffffffff 72057594037927936 16 0100000000000000 9223372036854775807 18 7fffffffffffffff}
do_test boundary4-1.5 {
  db eval {
    SELECT rowid, a, x FROM t1 ORDER BY +rowid DESC
  }
} {9223372036854775807 18 7fffffffffffffff 72057594037927936 16 0100000000000000 72057594037927935 27 00ffffffffffffff 36028797018963968 23 0080000000000000 36028797018963967 40 007fffffffffffff 281474976710656 32 0001000000000000 281474976710655 19 0000ffffffffffff 140737488355328 34 0000800000000000 140737488355327 38 00007fffffffffff 1099511627776 8 0000010000000000 1099511627775 20 000000ffffffffff 549755813888 35 0000008000000000 549755813887 1 0000007fffffffff 4294967296 11 0000000100000000 4294967295 37 00000000ffffffff 2147483648 36 0000000080000000 2147483647 46 000000007fffffff 16777216 15 0000000001000000 16777215 9 0000000000ffffff 8388608 5 0000000000800000 8388607 7 00000000007fffff 65536 33 0000000000010000 65535 6 000000000000ffff 32768 22 0000000000008000 32767 10 0000000000007fff 256 14 0000000000000100 255 29 00000000000000ff 128 41 0000000000000080 127 25 000000000000007f 0 3 0000000000000000 -1 17 ffffffffffffffff -128 45 ffffffffffffff80 -129 4 ffffffffffffff7f -32768 42 ffffffffffff8000 -32769 24 ffffffffffff7fff -8388608 2 ffffffffff800000 -8388609 21 ffffffffff7fffff -2147483648 31 ffffffff80000000 -2147483649 39 ffffffff7fffffff -549755813888 12 ffffff8000000000 -549755813889 28 ffffff7fffffffff -140737488355328 13 ffff800000000000 -140737488355329 44 ffff7fffffffffff -36028797018963968 43 ff80000000000000 -36028797018963969 30 ff7fffffffffffff -9223372036854775808 26 8000000000000000}
do_test boundary4-1.6 {
  db eval {
    SELECT rowid, a, x FROM t1 ORDER BY rowid DESC
  }
} {9223372036854775807 18 7fffffffffffffff 72057594037927936 16 0100000000000000 72057594037927935 27 00ffffffffffffff 36028797018963968 23 0080000000000000 36028797018963967 40 007fffffffffffff 281474976710656 32 0001000000000000 281474976710655 19 0000ffffffffffff 140737488355328 34 0000800000000000 140737488355327 38 00007fffffffffff 1099511627776 8 0000010000000000 1099511627775 20 000000ffffffffff 549755813888 35 0000008000000000 549755813887 1 0000007fffffffff 4294967296 11 0000000100000000 4294967295 37 00000000ffffffff 2147483648 36 0000000080000000 2147483647 46 000000007fffffff 16777216 15 0000000001000000 16777215 9 0000000000ffffff 8388608 5 0000000000800000 8388607 7 00000000007fffff 65536 33 0000000000010000 65535 6 000000000000ffff 32768 22 0000000000008000 32767 10 0000000000007fff 256 14 0000000000000100 255 29 00000000000000ff 128 41 0000000000000080 127 25 000000000000007f 0 3 0000000000000000 -1 17 ffffffffffffffff -128 45 ffffffffffffff80 -129 4 ffffffffffffff7f -32768 42 ffffffffffff8000 -32769 24 ffffffffffff7fff -8388608 2 ffffffffff800000 -8388609 21 ffffffffff7fffff -2147483648 31 ffffffff80000000 -2147483649 39 ffffffff7fffffff -549755813888 12 ffffff8000000000 -549755813889 28 ffffff7fffffffff -140737488355328 13 ffff800000000000 -140737488355329 44 ffff7fffffffffff -36028797018963968 43 ff80000000000000 -36028797018963969 30 ff7fffffffffffff -9223372036854775808 26 8000000000000000}
do_test boundary4-1.7 {
  db eval {
    SELECT rowid, a, x FROM t1 ORDER BY +a
  }
} {549755813887 1 0000007fffffffff -8388608 2 ffffffffff800000 0 3 0000000000000000 -129 4 ffffffffffffff7f 8388608 5 0000000000800000 65535 6 000000000000ffff 8388607 7 00000000007fffff 1099511627776 8 0000010000000000 16777215 9 0000000000ffffff 32767 10 0000000000007fff 4294967296 11 0000000100000000 -549755813888 12 ffffff8000000000 -140737488355328 13 ffff800000000000 256 14 0000000000000100 16777216 15 0000000001000000 72057594037927936 16 0100000000000000 -1 17 ffffffffffffffff 9223372036854775807 18 7fffffffffffffff 281474976710655 19 0000ffffffffffff 1099511627775 20 000000ffffffffff -8388609 21 ffffffffff7fffff 32768 22 0000000000008000 36028797018963968 23 0080000000000000 -32769 24 ffffffffffff7fff 127 25 000000000000007f -9223372036854775808 26 8000000000000000 72057594037927935 27 00ffffffffffffff -549755813889 28 ffffff7fffffffff 255 29 00000000000000ff -36028797018963969 30 ff7fffffffffffff -2147483648 31 ffffffff80000000 281474976710656 32 0001000000000000 65536 33 0000000000010000 140737488355328 34 0000800000000000 549755813888 35 0000008000000000 2147483648 36 0000000080000000 4294967295 37 00000000ffffffff 140737488355327 38 00007fffffffffff -2147483649 39 ffffffff7fffffff 36028797018963967 40 007fffffffffffff 128 41 0000000000000080 -32768 42 ffffffffffff8000 -36028797018963968 43 ff80000000000000 -140737488355329 44 ffff7fffffffffff -128 45 ffffffffffffff80 2147483647 46 000000007fffffff}
do_test boundary4-1.8 {
  db eval {
    SELECT rowid, a, x FROM t1 ORDER BY a
  }
} {549755813887 1 0000007fffffffff -8388608 2 ffffffffff800000 0 3 0000000000000000 -129 4 ffffffffffffff7f 8388608 5 0000000000800000 65535 6 000000000000ffff 8388607 7 00000000007fffff 1099511627776 8 0000010000000000 16777215 9 0000000000ffffff 32767 10 0000000000007fff 4294967296 11 0000000100000000 -549755813888 12 ffffff8000000000 -140737488355328 13 ffff800000000000 256 14 0000000000000100 16777216 15 0000000001000000 72057594037927936 16 0100000000000000 -1 17 ffffffffffffffff 9223372036854775807 18 7fffffffffffffff 281474976710655 19 0000ffffffffffff 1099511627775 20 000000ffffffffff -8388609 21 ffffffffff7fffff 32768 22 0000000000008000 36028797018963968 23 0080000000000000 -32769 24 ffffffffffff7fff 127 25 000000000000007f -9223372036854775808 26 8000000000000000 72057594037927935 27 00ffffffffffffff -549755813889 28 ffffff7fffffffff 255 29 00000000000000ff -36028797018963969 30 ff7fffffffffffff -2147483648 31 ffffffff80000000 281474976710656 32 0001000000000000 65536 33 0000000000010000 140737488355328 34 0000800000000000 549755813888 35 0000008000000000 2147483648 36 0000000080000000 4294967295 37 00000000ffffffff 140737488355327 38 00007fffffffffff -2147483649 39 ffffffff7fffffff 36028797018963967 40 007fffffffffffff 128 41 0000000000000080 -32768 42 ffffffffffff8000 -36028797018963968 43 ff80000000000000 -140737488355329 44 ffff7fffffffffff -128 45 ffffffffffffff80 2147483647 46 000000007fffffff}
do_test boundary4-1.9 {
  db eval {
    SELECT rowid, a, x FROM t1 ORDER BY +a DESC
  }
} {2147483647 46 000000007fffffff -128 45 ffffffffffffff80 -140737488355329 44 ffff7fffffffffff -36028797018963968 43 ff80000000000000 -32768 42 ffffffffffff8000 128 41 0000000000000080 36028797018963967 40 007fffffffffffff -2147483649 39 ffffffff7fffffff 140737488355327 38 00007fffffffffff 4294967295 37 00000000ffffffff 2147483648 36 0000000080000000 549755813888 35 0000008000000000 140737488355328 34 0000800000000000 65536 33 0000000000010000 281474976710656 32 0001000000000000 -2147483648 31 ffffffff80000000 -36028797018963969 30 ff7fffffffffffff 255 29 00000000000000ff -549755813889 28 ffffff7fffffffff 72057594037927935 27 00ffffffffffffff -9223372036854775808 26 8000000000000000 127 25 000000000000007f -32769 24 ffffffffffff7fff 36028797018963968 23 0080000000000000 32768 22 0000000000008000 -8388609 21 ffffffffff7fffff 1099511627775 20 000000ffffffffff 281474976710655 19 0000ffffffffffff 9223372036854775807 18 7fffffffffffffff -1 17 ffffffffffffffff 72057594037927936 16 0100000000000000 16777216 15 0000000001000000 256 14 0000000000000100 -140737488355328 13 ffff800000000000 -549755813888 12 ffffff8000000000 4294967296 11 0000000100000000 32767 10 0000000000007fff 16777215 9 0000000000ffffff 1099511627776 8 0000010000000000 8388607 7 00000000007fffff 65535 6 000000000000ffff 8388608 5 0000000000800000 -129 4 ffffffffffffff7f 0 3 0000000000000000 -8388608 2 ffffffffff800000 549755813887 1 0000007fffffffff}
do_test boundary4-1.10 {
  db eval {
    SELECT rowid, a, x FROM t1 ORDER BY a DESC
  }
} {2147483647 46 000000007fffffff -128 45 ffffffffffffff80 -140737488355329 44 ffff7fffffffffff -36028797018963968 43 ff80000000000000 -32768 42 ffffffffffff8000 128 41 0000000000000080 36028797018963967 40 007fffffffffffff -2147483649 39 ffffffff7fffffff 140737488355327 38 00007fffffffffff 4294967295 37 00000000ffffffff 2147483648 36 0000000080000000 549755813888 35 0000008000000000 140737488355328 34 0000800000000000 65536 33 0000000000010000 281474976710656 32 0001000000000000 -2147483648 31 ffffffff80000000 -36028797018963969 30 ff7fffffffffffff 255 29 00000000000000ff -549755813889 28 ffffff7fffffffff 72057594037927935 27 00ffffffffffffff -9223372036854775808 26 8000000000000000 127 25 000000000000007f -32769 24 ffffffffffff7fff 36028797018963968 23 0080000000000000 32768 22 0000000000008000 -8388609 21 ffffffffff7fffff 1099511627775 20 000000ffffffffff 281474976710655 19 0000ffffffffffff 9223372036854775807 18 7fffffffffffffff -1 17 ffffffffffffffff 72057594037927936 16 0100000000000000 16777216 15 0000000001000000 256 14 0000000000000100 -140737488355328 13 ffff800000000000 -549755813888 12 ffffff8000000000 4294967296 11 0000000100000000 32767 10 0000000000007fff 16777215 9 0000000000ffffff 1099511627776 8 0000010000000000 8388607 7 00000000007fffff 65535 6 000000000000ffff 8388608 5 0000000000800000 -129 4 ffffffffffffff7f 0 3 0000000000000000 -8388608 2 ffffffffff800000 549755813887 1 0000007fffffffff}
do_test boundary4-1.11 {
  db eval {
    SELECT rowid, a, x FROM t1 ORDER BY +x
  }
} {0 3 0000000000000000 127 25 000000000000007f 128 41 0000000000000080 255 29 00000000000000ff 256 14 0000000000000100 32767 10 0000000000007fff 32768 22 0000000000008000 65535 6 000000000000ffff 65536 33 0000000000010000 8388607 7 00000000007fffff 8388608 5 0000000000800000 16777215 9 0000000000ffffff 16777216 15 0000000001000000 2147483647 46 000000007fffffff 2147483648 36 0000000080000000 4294967295 37 00000000ffffffff 4294967296 11 0000000100000000 549755813887 1 0000007fffffffff 549755813888 35 0000008000000000 1099511627775 20 000000ffffffffff 1099511627776 8 0000010000000000 140737488355327 38 00007fffffffffff 140737488355328 34 0000800000000000 281474976710655 19 0000ffffffffffff 281474976710656 32 0001000000000000 36028797018963967 40 007fffffffffffff 36028797018963968 23 0080000000000000 72057594037927935 27 00ffffffffffffff 72057594037927936 16 0100000000000000 9223372036854775807 18 7fffffffffffffff -9223372036854775808 26 8000000000000000 -36028797018963969 30 ff7fffffffffffff -36028797018963968 43 ff80000000000000 -140737488355329 44 ffff7fffffffffff -140737488355328 13 ffff800000000000 -549755813889 28 ffffff7fffffffff -549755813888 12 ffffff8000000000 -2147483649 39 ffffffff7fffffff -2147483648 31 ffffffff80000000 -8388609 21 ffffffffff7fffff -8388608 2 ffffffffff800000 -32769 24 ffffffffffff7fff -32768 42 ffffffffffff8000 -129 4 ffffffffffffff7f -128 45 ffffffffffffff80 -1 17 ffffffffffffffff}
do_test boundary4-1.12 {
  db eval {
    SELECT rowid, a, x FROM t1 ORDER BY x
  }
} {0 3 0000000000000000 127 25 000000000000007f 128 41 0000000000000080 255 29 00000000000000ff 256 14 0000000000000100 32767 10 0000000000007fff 32768 22 0000000000008000 65535 6 000000000000ffff 65536 33 0000000000010000 8388607 7 00000000007fffff 8388608 5 0000000000800000 16777215 9 0000000000ffffff 16777216 15 0000000001000000 2147483647 46 000000007fffffff 2147483648 36 0000000080000000 4294967295 37 00000000ffffffff 4294967296 11 0000000100000000 549755813887 1 0000007fffffffff 549755813888 35 0000008000000000 1099511627775 20 000000ffffffffff 1099511627776 8 0000010000000000 140737488355327 38 00007fffffffffff 140737488355328 34 0000800000000000 281474976710655 19 0000ffffffffffff 281474976710656 32 0001000000000000 36028797018963967 40 007fffffffffffff 36028797018963968 23 0080000000000000 72057594037927935 27 00ffffffffffffff 72057594037927936 16 0100000000000000 9223372036854775807 18 7fffffffffffffff -9223372036854775808 26 8000000000000000 -36028797018963969 30 ff7fffffffffffff -36028797018963968 43 ff80000000000000 -140737488355329 44 ffff7fffffffffff -140737488355328 13 ffff800000000000 -549755813889 28 ffffff7fffffffff -549755813888 12 ffffff8000000000 -2147483649 39 ffffffff7fffffff -2147483648 31 ffffffff80000000 -8388609 21 ffffffffff7fffff -8388608 2 ffffffffff800000 -32769 24 ffffffffffff7fff -32768 42 ffffffffffff8000 -129 4 ffffffffffffff7f -128 45 ffffffffffffff80 -1 17 ffffffffffffffff}
do_test boundary4-1.13 {
  db eval {
    SELECT rowid, a, x FROM t1 ORDER BY +x DESC
  }
} {-1 17 ffffffffffffffff -128 45 ffffffffffffff80 -129 4 ffffffffffffff7f -32768 42 ffffffffffff8000 -32769 24 ffffffffffff7fff -8388608 2 ffffffffff800000 -8388609 21 ffffffffff7fffff -2147483648 31 ffffffff80000000 -2147483649 39 ffffffff7fffffff -549755813888 12 ffffff8000000000 -549755813889 28 ffffff7fffffffff -140737488355328 13 ffff800000000000 -140737488355329 44 ffff7fffffffffff -36028797018963968 43 ff80000000000000 -36028797018963969 30 ff7fffffffffffff -9223372036854775808 26 8000000000000000 9223372036854775807 18 7fffffffffffffff 72057594037927936 16 0100000000000000 72057594037927935 27 00ffffffffffffff 36028797018963968 23 0080000000000000 36028797018963967 40 007fffffffffffff 281474976710656 32 0001000000000000 281474976710655 19 0000ffffffffffff 140737488355328 34 0000800000000000 140737488355327 38 00007fffffffffff 1099511627776 8 0000010000000000 1099511627775 20 000000ffffffffff 549755813888 35 0000008000000000 549755813887 1 0000007fffffffff 4294967296 11 0000000100000000 4294967295 37 00000000ffffffff 2147483648 36 0000000080000000 2147483647 46 000000007fffffff 16777216 15 0000000001000000 16777215 9 0000000000ffffff 8388608 5 0000000000800000 8388607 7 00000000007fffff 65536 33 0000000000010000 65535 6 000000000000ffff 32768 22 0000000000008000 32767 10 0000000000007fff 256 14 0000000000000100 255 29 00000000000000ff 128 41 0000000000000080 127 25 000000000000007f 0 3 0000000000000000}
do_test boundary4-1.14 {
  db eval {
    SELECT rowid, a, x FROM t1 ORDER BY x DESC
  }
} {-1 17 ffffffffffffffff -128 45 ffffffffffffff80 -129 4 ffffffffffffff7f -32768 42 ffffffffffff8000 -32769 24 ffffffffffff7fff -8388608 2 ffffffffff800000 -8388609 21 ffffffffff7fffff -2147483648 31 ffffffff80000000 -2147483649 39 ffffffff7fffffff -549755813888 12 ffffff8000000000 -549755813889 28 ffffff7fffffffff -140737488355328 13 ffff800000000000 -140737488355329 44 ffff7fffffffffff -36028797018963968 43 ff80000000000000 -36028797018963969 30 ff7fffffffffffff -9223372036854775808 26 8000000000000000 9223372036854775807 18 7fffffffffffffff 72057594037927936 16 0100000000000000 72057594037927935 27 00ffffffffffffff 36028797018963968 23 0080000000000000 36028797018963967 40 007fffffffffffff 281474976710656 32 0001000000000000 281474976710655 19 0000ffffffffffff 140737488355328 34 0000800000000000 140737488355327 38 00007fffffffffff 1099511627776 8 0000010000000000 1099511627775 20 000000ffffffffff 549755813888 35 0000008000000000 549755813887 1 0000007fffffffff 4294967296 11 0000000100000000 4294967295 37 00000000ffffffff 2147483648 36 0000000080000000 2147483647 46 000000007fffffff 16777216 15 0000000001000000 16777215 9 0000000000ffffff 8388608 5 0000000000800000 8388607 7 00000000007fffff 65536 33 0000000000010000 65535 6 000000000000ffff 32768 22 0000000000008000 32767 10 0000000000007fff 256 14 0000000000000100 255 29 00000000000000ff 128 41 0000000000000080 127 25 000000000000007f 0 3 0000000000000000}
do_test boundary4-2.1 {
  db eval {
    UPDATE t1 SET rowid=a, a=rowid
  }
} {}
do_test boundary4-2.3 {
  db eval {
    SELECT a, rowid, x FROM t1 ORDER BY +a
  }
} {-9223372036854775808 26 8000000000000000 -36028797018963969 30 ff7fffffffffffff -36028797018963968 43 ff80000000000000 -140737488355329 44 ffff7fffffffffff -140737488355328 13 ffff800000000000 -549755813889 28 ffffff7fffffffff -549755813888 12 ffffff8000000000 -2147483649 39 ffffffff7fffffff -2147483648 31 ffffffff80000000 -8388609 21 ffffffffff7fffff -8388608 2 ffffffffff800000 -32769 24 ffffffffffff7fff -32768 42 ffffffffffff8000 -129 4 ffffffffffffff7f -128 45 ffffffffffffff80 -1 17 ffffffffffffffff 0 3 0000000000000000 127 25 000000000000007f 128 41 0000000000000080 255 29 00000000000000ff 256 14 0000000000000100 32767 10 0000000000007fff 32768 22 0000000000008000 65535 6 000000000000ffff 65536 33 0000000000010000 8388607 7 00000000007fffff 8388608 5 0000000000800000 16777215 9 0000000000ffffff 16777216 15 0000000001000000 2147483647 46 000000007fffffff 2147483648 36 0000000080000000 4294967295 37 00000000ffffffff 4294967296 11 0000000100000000 549755813887 1 0000007fffffffff 549755813888 35 0000008000000000 1099511627775 20 000000ffffffffff 1099511627776 8 0000010000000000 140737488355327 38 00007fffffffffff 140737488355328 34 0000800000000000 281474976710655 19 0000ffffffffffff 281474976710656 32 0001000000000000 36028797018963967 40 007fffffffffffff 36028797018963968 23 0080000000000000 72057594037927935 27 00ffffffffffffff 72057594037927936 16 0100000000000000 9223372036854775807 18 7fffffffffffffff}
do_test boundary4-2.4 {
  db eval {
    SELECT a, rowid, x FROM t1 ORDER BY a
  }
} {-9223372036854775808 26 8000000000000000 -36028797018963969 30 ff7fffffffffffff -36028797018963968 43 ff80000000000000 -140737488355329 44 ffff7fffffffffff -140737488355328 13 ffff800000000000 -549755813889 28 ffffff7fffffffff -549755813888 12 ffffff8000000000 -2147483649 39 ffffffff7fffffff -2147483648 31 ffffffff80000000 -8388609 21 ffffffffff7fffff -8388608 2 ffffffffff800000 -32769 24 ffffffffffff7fff -32768 42 ffffffffffff8000 -129 4 ffffffffffffff7f -128 45 ffffffffffffff80 -1 17 ffffffffffffffff 0 3 0000000000000000 127 25 000000000000007f 128 41 0000000000000080 255 29 00000000000000ff 256 14 0000000000000100 32767 10 0000000000007fff 32768 22 0000000000008000 65535 6 000000000000ffff 65536 33 0000000000010000 8388607 7 00000000007fffff 8388608 5 0000000000800000 16777215 9 0000000000ffffff 16777216 15 0000000001000000 2147483647 46 000000007fffffff 2147483648 36 0000000080000000 4294967295 37 00000000ffffffff 4294967296 11 0000000100000000 549755813887 1 0000007fffffffff 549755813888 35 0000008000000000 1099511627775 20 000000ffffffffff 1099511627776 8 0000010000000000 140737488355327 38 00007fffffffffff 140737488355328 34 0000800000000000 281474976710655 19 0000ffffffffffff 281474976710656 32 0001000000000000 36028797018963967 40 007fffffffffffff 36028797018963968 23 0080000000000000 72057594037927935 27 00ffffffffffffff 72057594037927936 16 0100000000000000 9223372036854775807 18 7fffffffffffffff}
do_test boundary4-2.5 {
  db eval {
    SELECT a, rowid, x FROM t1 ORDER BY +a DESC
  }
} {9223372036854775807 18 7fffffffffffffff 72057594037927936 16 0100000000000000 72057594037927935 27 00ffffffffffffff 36028797018963968 23 0080000000000000 36028797018963967 40 007fffffffffffff 281474976710656 32 0001000000000000 281474976710655 19 0000ffffffffffff 140737488355328 34 0000800000000000 140737488355327 38 00007fffffffffff 1099511627776 8 0000010000000000 1099511627775 20 000000ffffffffff 549755813888 35 0000008000000000 549755813887 1 0000007fffffffff 4294967296 11 0000000100000000 4294967295 37 00000000ffffffff 2147483648 36 0000000080000000 2147483647 46 000000007fffffff 16777216 15 0000000001000000 16777215 9 0000000000ffffff 8388608 5 0000000000800000 8388607 7 00000000007fffff 65536 33 0000000000010000 65535 6 000000000000ffff 32768 22 0000000000008000 32767 10 0000000000007fff 256 14 0000000000000100 255 29 00000000000000ff 128 41 0000000000000080 127 25 000000000000007f 0 3 0000000000000000 -1 17 ffffffffffffffff -128 45 ffffffffffffff80 -129 4 ffffffffffffff7f -32768 42 ffffffffffff8000 -32769 24 ffffffffffff7fff -8388608 2 ffffffffff800000 -8388609 21 ffffffffff7fffff -2147483648 31 ffffffff80000000 -2147483649 39 ffffffff7fffffff -549755813888 12 ffffff8000000000 -549755813889 28 ffffff7fffffffff -140737488355328 13 ffff800000000000 -140737488355329 44 ffff7fffffffffff -36028797018963968 43 ff80000000000000 -36028797018963969 30 ff7fffffffffffff -9223372036854775808 26 8000000000000000}
do_test boundary4-2.6 {
  db eval {
    SELECT a, rowid, x FROM t1 ORDER BY a DESC
  }
} {9223372036854775807 18 7fffffffffffffff 72057594037927936 16 0100000000000000 72057594037927935 27 00ffffffffffffff 36028797018963968 23 0080000000000000 36028797018963967 40 007fffffffffffff 281474976710656 32 0001000000000000 281474976710655 19 0000ffffffffffff 140737488355328 34 0000800000000000 140737488355327 38 00007fffffffffff 1099511627776 8 0000010000000000 1099511627775 20 000000ffffffffff 549755813888 35 0000008000000000 549755813887 1 0000007fffffffff 4294967296 11 0000000100000000 4294967295 37 00000000ffffffff 2147483648 36 0000000080000000 2147483647 46 000000007fffffff 16777216 15 0000000001000000 16777215 9 0000000000ffffff 8388608 5 0000000000800000 8388607 7 00000000007fffff 65536 33 0000000000010000 65535 6 000000000000ffff 32768 22 0000000000008000 32767 10 0000000000007fff 256 14 0000000000000100 255 29 00000000000000ff 128 41 0000000000000080 127 25 000000000000007f 0 3 0000000000000000 -1 17 ffffffffffffffff -128 45 ffffffffffffff80 -129 4 ffffffffffffff7f -32768 42 ffffffffffff8000 -32769 24 ffffffffffff7fff -8388608 2 ffffffffff800000 -8388609 21 ffffffffff7fffff -2147483648 31 ffffffff80000000 -2147483649 39 ffffffff7fffffff -549755813888 12 ffffff8000000000 -549755813889 28 ffffff7fffffffff -140737488355328 13 ffff800000000000 -140737488355329 44 ffff7fffffffffff -36028797018963968 43 ff80000000000000 -36028797018963969 30 ff7fffffffffffff -9223372036854775808 26 8000000000000000}
do_test boundary4-2.7 {
  db eval {
    SELECT a, rowid, x FROM t1 ORDER BY +rowid
  }
} {549755813887 1 0000007fffffffff -8388608 2 ffffffffff800000 0 3 0000000000000000 -129 4 ffffffffffffff7f 8388608 5 0000000000800000 65535 6 000000000000ffff 8388607 7 00000000007fffff 1099511627776 8 0000010000000000 16777215 9 0000000000ffffff 32767 10 0000000000007fff 4294967296 11 0000000100000000 -549755813888 12 ffffff8000000000 -140737488355328 13 ffff800000000000 256 14 0000000000000100 16777216 15 0000000001000000 72057594037927936 16 0100000000000000 -1 17 ffffffffffffffff 9223372036854775807 18 7fffffffffffffff 281474976710655 19 0000ffffffffffff 1099511627775 20 000000ffffffffff -8388609 21 ffffffffff7fffff 32768 22 0000000000008000 36028797018963968 23 0080000000000000 -32769 24 ffffffffffff7fff 127 25 000000000000007f -9223372036854775808 26 8000000000000000 72057594037927935 27 00ffffffffffffff -549755813889 28 ffffff7fffffffff 255 29 00000000000000ff -36028797018963969 30 ff7fffffffffffff -2147483648 31 ffffffff80000000 281474976710656 32 0001000000000000 65536 33 0000000000010000 140737488355328 34 0000800000000000 549755813888 35 0000008000000000 2147483648 36 0000000080000000 4294967295 37 00000000ffffffff 140737488355327 38 00007fffffffffff -2147483649 39 ffffffff7fffffff 36028797018963967 40 007fffffffffffff 128 41 0000000000000080 -32768 42 ffffffffffff8000 -36028797018963968 43 ff80000000000000 -140737488355329 44 ffff7fffffffffff -128 45 ffffffffffffff80 2147483647 46 000000007fffffff}
do_test boundary4-2.8 {
  db eval {
    SELECT a, rowid, x FROM t1 ORDER BY rowid
  }
} {549755813887 1 0000007fffffffff -8388608 2 ffffffffff800000 0 3 0000000000000000 -129 4 ffffffffffffff7f 8388608 5 0000000000800000 65535 6 000000000000ffff 8388607 7 00000000007fffff 1099511627776 8 0000010000000000 16777215 9 0000000000ffffff 32767 10 0000000000007fff 4294967296 11 0000000100000000 -549755813888 12 ffffff8000000000 -140737488355328 13 ffff800000000000 256 14 0000000000000100 16777216 15 0000000001000000 72057594037927936 16 0100000000000000 -1 17 ffffffffffffffff 9223372036854775807 18 7fffffffffffffff 281474976710655 19 0000ffffffffffff 1099511627775 20 000000ffffffffff -8388609 21 ffffffffff7fffff 32768 22 0000000000008000 36028797018963968 23 0080000000000000 -32769 24 ffffffffffff7fff 127 25 000000000000007f -9223372036854775808 26 8000000000000000 72057594037927935 27 00ffffffffffffff -549755813889 28 ffffff7fffffffff 255 29 00000000000000ff -36028797018963969 30 ff7fffffffffffff -2147483648 31 ffffffff80000000 281474976710656 32 0001000000000000 65536 33 0000000000010000 140737488355328 34 0000800000000000 549755813888 35 0000008000000000 2147483648 36 0000000080000000 4294967295 37 00000000ffffffff 140737488355327 38 00007fffffffffff -2147483649 39 ffffffff7fffffff 36028797018963967 40 007fffffffffffff 128 41 0000000000000080 -32768 42 ffffffffffff8000 -36028797018963968 43 ff80000000000000 -140737488355329 44 ffff7fffffffffff -128 45 ffffffffffffff80 2147483647 46 000000007fffffff}
do_test boundary4-2.9 {
  db eval {
    SELECT a, rowid, x FROM t1 ORDER BY +rowid DESC
  }
} {2147483647 46 000000007fffffff -128 45 ffffffffffffff80 -140737488355329 44 ffff7fffffffffff -36028797018963968 43 ff80000000000000 -32768 42 ffffffffffff8000 128 41 0000000000000080 36028797018963967 40 007fffffffffffff -2147483649 39 ffffffff7fffffff 140737488355327 38 00007fffffffffff 4294967295 37 00000000ffffffff 2147483648 36 0000000080000000 549755813888 35 0000008000000000 140737488355328 34 0000800000000000 65536 33 0000000000010000 281474976710656 32 0001000000000000 -2147483648 31 ffffffff80000000 -36028797018963969 30 ff7fffffffffffff 255 29 00000000000000ff -549755813889 28 ffffff7fffffffff 72057594037927935 27 00ffffffffffffff -9223372036854775808 26 8000000000000000 127 25 000000000000007f -32769 24 ffffffffffff7fff 36028797018963968 23 0080000000000000 32768 22 0000000000008000 -8388609 21 ffffffffff7fffff 1099511627775 20 000000ffffffffff 281474976710655 19 0000ffffffffffff 9223372036854775807 18 7fffffffffffffff -1 17 ffffffffffffffff 72057594037927936 16 0100000000000000 16777216 15 0000000001000000 256 14 0000000000000100 -140737488355328 13 ffff800000000000 -549755813888 12 ffffff8000000000 4294967296 11 0000000100000000 32767 10 0000000000007fff 16777215 9 0000000000ffffff 1099511627776 8 0000010000000000 8388607 7 00000000007fffff 65535 6 000000000000ffff 8388608 5 0000000000800000 -129 4 ffffffffffffff7f 0 3 0000000000000000 -8388608 2 ffffffffff800000 549755813887 1 0000007fffffffff}
do_test boundary4-2.10 {
  db eval {
    SELECT a, rowid, x FROM t1 ORDER BY rowid DESC
  }
} {2147483647 46 000000007fffffff -128 45 ffffffffffffff80 -140737488355329 44 ffff7fffffffffff -36028797018963968 43 ff80000000000000 -32768 42 ffffffffffff8000 128 41 0000000000000080 36028797018963967 40 007fffffffffffff -2147483649 39 ffffffff7fffffff 140737488355327 38 00007fffffffffff 4294967295 37 00000000ffffffff 2147483648 36 0000000080000000 549755813888 35 0000008000000000 140737488355328 34 0000800000000000 65536 33 0000000000010000 281474976710656 32 0001000000000000 -2147483648 31 ffffffff80000000 -36028797018963969 30 ff7fffffffffffff 255 29 00000000000000ff -549755813889 28 ffffff7fffffffff 72057594037927935 27 00ffffffffffffff -9223372036854775808 26 8000000000000000 127 25 000000000000007f -32769 24 ffffffffffff7fff 36028797018963968 23 0080000000000000 32768 22 0000000000008000 -8388609 21 ffffffffff7fffff 1099511627775 20 000000ffffffffff 281474976710655 19 0000ffffffffffff 9223372036854775807 18 7fffffffffffffff -1 17 ffffffffffffffff 72057594037927936 16 0100000000000000 16777216 15 0000000001000000 256 14 0000000000000100 -140737488355328 13 ffff800000000000 -549755813888 12 ffffff8000000000 4294967296 11 0000000100000000 32767 10 0000000000007fff 16777215 9 0000000000ffffff 1099511627776 8 0000010000000000 8388607 7 00000000007fffff 65535 6 000000000000ffff 8388608 5 0000000000800000 -129 4 ffffffffffffff7f 0 3 0000000000000000 -8388608 2 ffffffffff800000 549755813887 1 0000007fffffffff}
do_test boundary4-2.11 {
  db eval {
    SELECT a, rowid, x FROM t1 ORDER BY +x
  }
} {0 3 0000000000000000 127 25 000000000000007f 128 41 0000000000000080 255 29 00000000000000ff 256 14 0000000000000100 32767 10 0000000000007fff 32768 22 0000000000008000 65535 6 000000000000ffff 65536 33 0000000000010000 8388607 7 00000000007fffff 8388608 5 0000000000800000 16777215 9 0000000000ffffff 16777216 15 0000000001000000 2147483647 46 000000007fffffff 2147483648 36 0000000080000000 4294967295 37 00000000ffffffff 4294967296 11 0000000100000000 549755813887 1 0000007fffffffff 549755813888 35 0000008000000000 1099511627775 20 000000ffffffffff 1099511627776 8 0000010000000000 140737488355327 38 00007fffffffffff 140737488355328 34 0000800000000000 281474976710655 19 0000ffffffffffff 281474976710656 32 0001000000000000 36028797018963967 40 007fffffffffffff 36028797018963968 23 0080000000000000 72057594037927935 27 00ffffffffffffff 72057594037927936 16 0100000000000000 9223372036854775807 18 7fffffffffffffff -9223372036854775808 26 8000000000000000 -36028797018963969 30 ff7fffffffffffff -36028797018963968 43 ff80000000000000 -140737488355329 44 ffff7fffffffffff -140737488355328 13 ffff800000000000 -549755813889 28 ffffff7fffffffff -549755813888 12 ffffff8000000000 -2147483649 39 ffffffff7fffffff -2147483648 31 ffffffff80000000 -8388609 21 ffffffffff7fffff -8388608 2 ffffffffff800000 -32769 24 ffffffffffff7fff -32768 42 ffffffffffff8000 -129 4 ffffffffffffff7f -128 45 ffffffffffffff80 -1 17 ffffffffffffffff}
do_test boundary4-2.12 {
  db eval {
    SELECT a, rowid, x FROM t1 ORDER BY x
  }
} {0 3 0000000000000000 127 25 000000000000007f 128 41 0000000000000080 255 29 00000000000000ff 256 14 0000000000000100 32767 10 0000000000007fff 32768 22 0000000000008000 65535 6 000000000000ffff 65536 33 0000000000010000 8388607 7 00000000007fffff 8388608 5 0000000000800000 16777215 9 0000000000ffffff 16777216 15 0000000001000000 2147483647 46 000000007fffffff 2147483648 36 0000000080000000 4294967295 37 00000000ffffffff 4294967296 11 0000000100000000 549755813887 1 0000007fffffffff 549755813888 35 0000008000000000 1099511627775 20 000000ffffffffff 1099511627776 8 0000010000000000 140737488355327 38 00007fffffffffff 140737488355328 34 0000800000000000 281474976710655 19 0000ffffffffffff 281474976710656 32 0001000000000000 36028797018963967 40 007fffffffffffff 36028797018963968 23 0080000000000000 72057594037927935 27 00ffffffffffffff 72057594037927936 16 0100000000000000 9223372036854775807 18 7fffffffffffffff -9223372036854775808 26 8000000000000000 -36028797018963969 30 ff7fffffffffffff -36028797018963968 43 ff80000000000000 -140737488355329 44 ffff7fffffffffff -140737488355328 13 ffff800000000000 -549755813889 28 ffffff7fffffffff -549755813888 12 ffffff8000000000 -2147483649 39 ffffffff7fffffff -2147483648 31 ffffffff80000000 -8388609 21 ffffffffff7fffff -8388608 2 ffffffffff800000 -32769 24 ffffffffffff7fff -32768 42 ffffffffffff8000 -129 4 ffffffffffffff7f -128 45 ffffffffffffff80 -1 17 ffffffffffffffff}
do_test boundary4-2.13 {
  db eval {
    SELECT a, rowid, x FROM t1 ORDER BY +x DESC
  }
} {-1 17 ffffffffffffffff -128 45 ffffffffffffff80 -129 4 ffffffffffffff7f -32768 42 ffffffffffff8000 -32769 24 ffffffffffff7fff -8388608 2 ffffffffff800000 -8388609 21 ffffffffff7fffff -2147483648 31 ffffffff80000000 -2147483649 39 ffffffff7fffffff -549755813888 12 ffffff8000000000 -549755813889 28 ffffff7fffffffff -140737488355328 13 ffff800000000000 -140737488355329 44 ffff7fffffffffff -36028797018963968 43 ff80000000000000 -36028797018963969 30 ff7fffffffffffff -9223372036854775808 26 8000000000000000 9223372036854775807 18 7fffffffffffffff 72057594037927936 16 0100000000000000 72057594037927935 27 00ffffffffffffff 36028797018963968 23 0080000000000000 36028797018963967 40 007fffffffffffff 281474976710656 32 0001000000000000 281474976710655 19 0000ffffffffffff 140737488355328 34 0000800000000000 140737488355327 38 00007fffffffffff 1099511627776 8 0000010000000000 1099511627775 20 000000ffffffffff 549755813888 35 0000008000000000 549755813887 1 0000007fffffffff 4294967296 11 0000000100000000 4294967295 37 00000000ffffffff 2147483648 36 0000000080000000 2147483647 46 000000007fffffff 16777216 15 0000000001000000 16777215 9 0000000000ffffff 8388608 5 0000000000800000 8388607 7 00000000007fffff 65536 33 0000000000010000 65535 6 000000000000ffff 32768 22 0000000000008000 32767 10 0000000000007fff 256 14 0000000000000100 255 29 00000000000000ff 128 41 0000000000000080 127 25 000000000000007f 0 3 0000000000000000}
do_test boundary4-2.14 {
  db eval {
    SELECT a, rowid, x FROM t1 ORDER BY x DESC
  }
} {-1 17 ffffffffffffffff -128 45 ffffffffffffff80 -129 4 ffffffffffffff7f -32768 42 ffffffffffff8000 -32769 24 ffffffffffff7fff -8388608 2 ffffffffff800000 -8388609 21 ffffffffff7fffff -2147483648 31 ffffffff80000000 -2147483649 39 ffffffff7fffffff -549755813888 12 ffffff8000000000 -549755813889 28 ffffff7fffffffff -140737488355328 13 ffff800000000000 -140737488355329 44 ffff7fffffffffff -36028797018963968 43 ff80000000000000 -36028797018963969 30 ff7fffffffffffff -9223372036854775808 26 8000000000000000 9223372036854775807 18 7fffffffffffffff 72057594037927936 16 0100000000000000 72057594037927935 27 00ffffffffffffff 36028797018963968 23 0080000000000000 36028797018963967 40 007fffffffffffff 281474976710656 32 0001000000000000 281474976710655 19 0000ffffffffffff 140737488355328 34 0000800000000000 140737488355327 38 00007fffffffffff 1099511627776 8 0000010000000000 1099511627775 20 000000ffffffffff 549755813888 35 0000008000000000 549755813887 1 0000007fffffffff 4294967296 11 0000000100000000 4294967295 37 00000000ffffffff 2147483648 36 0000000080000000 2147483647 46 000000007fffffff 16777216 15 0000000001000000 16777215 9 0000000000ffffff 8388608 5 0000000000800000 8388607 7 00000000007fffff 65536 33 0000000000010000 65535 6 000000000000ffff 32768 22 0000000000008000 32767 10 0000000000007fff 256 14 0000000000000100 255 29 00000000000000ff 128 41 0000000000000080 127 25 000000000000007f 0 3 0000000000000000}
do_test boundary4-3.1 {
  db eval {
    UPDATE t1 SET rowid=a, a=rowid
  }
} {}
do_test boundary4-3.2 {
  db eval {
    ALTER TABLE t1 ADD COLUMN z; UPDATE t1 SET z=zeroblob(600)
  }
} {}
do_test boundary4-3.3 {
  db eval {
    SELECT rowid, a, x FROM t1 ORDER BY +rowid
  }
} {-9223372036854775808 26 8000000000000000 -36028797018963969 30 ff7fffffffffffff -36028797018963968 43 ff80000000000000 -140737488355329 44 ffff7fffffffffff -140737488355328 13 ffff800000000000 -549755813889 28 ffffff7fffffffff -549755813888 12 ffffff8000000000 -2147483649 39 ffffffff7fffffff -2147483648 31 ffffffff80000000 -8388609 21 ffffffffff7fffff -8388608 2 ffffffffff800000 -32769 24 ffffffffffff7fff -32768 42 ffffffffffff8000 -129 4 ffffffffffffff7f -128 45 ffffffffffffff80 -1 17 ffffffffffffffff 0 3 0000000000000000 127 25 000000000000007f 128 41 0000000000000080 255 29 00000000000000ff 256 14 0000000000000100 32767 10 0000000000007fff 32768 22 0000000000008000 65535 6 000000000000ffff 65536 33 0000000000010000 8388607 7 00000000007fffff 8388608 5 0000000000800000 16777215 9 0000000000ffffff 16777216 15 0000000001000000 2147483647 46 000000007fffffff 2147483648 36 0000000080000000 4294967295 37 00000000ffffffff 4294967296 11 0000000100000000 549755813887 1 0000007fffffffff 549755813888 35 0000008000000000 1099511627775 20 000000ffffffffff 1099511627776 8 0000010000000000 140737488355327 38 00007fffffffffff 140737488355328 34 0000800000000000 281474976710655 19 0000ffffffffffff 281474976710656 32 0001000000000000 36028797018963967 40 007fffffffffffff 36028797018963968 23 0080000000000000 72057594037927935 27 00ffffffffffffff 72057594037927936 16 0100000000000000 9223372036854775807 18 7fffffffffffffff}
do_test boundary4-3.4 {
  db eval {
    SELECT rowid, a, x FROM t1 ORDER BY rowid
  }
} {-9223372036854775808 26 8000000000000000 -36028797018963969 30 ff7fffffffffffff -36028797018963968 43 ff80000000000000 -140737488355329 44 ffff7fffffffffff -140737488355328 13 ffff800000000000 -549755813889 28 ffffff7fffffffff -549755813888 12 ffffff8000000000 -2147483649 39 ffffffff7fffffff -2147483648 31 ffffffff80000000 -8388609 21 ffffffffff7fffff -8388608 2 ffffffffff800000 -32769 24 ffffffffffff7fff -32768 42 ffffffffffff8000 -129 4 ffffffffffffff7f -128 45 ffffffffffffff80 -1 17 ffffffffffffffff 0 3 0000000000000000 127 25 000000000000007f 128 41 0000000000000080 255 29 00000000000000ff 256 14 0000000000000100 32767 10 0000000000007fff 32768 22 0000000000008000 65535 6 000000000000ffff 65536 33 0000000000010000 8388607 7 00000000007fffff 8388608 5 0000000000800000 16777215 9 0000000000ffffff 16777216 15 0000000001000000 2147483647 46 000000007fffffff 2147483648 36 0000000080000000 4294967295 37 00000000ffffffff 4294967296 11 0000000100000000 549755813887 1 0000007fffffffff 549755813888 35 0000008000000000 1099511627775 20 000000ffffffffff 1099511627776 8 0000010000000000 140737488355327 38 00007fffffffffff 140737488355328 34 0000800000000000 281474976710655 19 0000ffffffffffff 281474976710656 32 0001000000000000 36028797018963967 40 007fffffffffffff 36028797018963968 23 0080000000000000 72057594037927935 27 00ffffffffffffff 72057594037927936 16 0100000000000000 9223372036854775807 18 7fffffffffffffff}
do_test boundary4-3.5 {
  db eval {
    SELECT rowid, a, x FROM t1 ORDER BY +rowid DESC
  }
} {9223372036854775807 18 7fffffffffffffff 72057594037927936 16 0100000000000000 72057594037927935 27 00ffffffffffffff 36028797018963968 23 0080000000000000 36028797018963967 40 007fffffffffffff 281474976710656 32 0001000000000000 281474976710655 19 0000ffffffffffff 140737488355328 34 0000800000000000 140737488355327 38 00007fffffffffff 1099511627776 8 0000010000000000 1099511627775 20 000000ffffffffff 549755813888 35 0000008000000000 549755813887 1 0000007fffffffff 4294967296 11 0000000100000000 4294967295 37 00000000ffffffff 2147483648 36 0000000080000000 2147483647 46 000000007fffffff 16777216 15 0000000001000000 16777215 9 0000000000ffffff 8388608 5 0000000000800000 8388607 7 00000000007fffff 65536 33 0000000000010000 65535 6 000000000000ffff 32768 22 0000000000008000 32767 10 0000000000007fff 256 14 0000000000000100 255 29 00000000000000ff 128 41 0000000000000080 127 25 000000000000007f 0 3 0000000000000000 -1 17 ffffffffffffffff -128 45 ffffffffffffff80 -129 4 ffffffffffffff7f -32768 42 ffffffffffff8000 -32769 24 ffffffffffff7fff -8388608 2 ffffffffff800000 -8388609 21 ffffffffff7fffff -2147483648 31 ffffffff80000000 -2147483649 39 ffffffff7fffffff -549755813888 12 ffffff8000000000 -549755813889 28 ffffff7fffffffff -140737488355328 13 ffff800000000000 -140737488355329 44 ffff7fffffffffff -36028797018963968 43 ff80000000000000 -36028797018963969 30 ff7fffffffffffff -9223372036854775808 26 8000000000000000}
do_test boundary4-3.6 {
  db eval {
    SELECT rowid, a, x FROM t1 ORDER BY rowid DESC
  }
} {9223372036854775807 18 7fffffffffffffff 72057594037927936 16 0100000000000000 72057594037927935 27 00ffffffffffffff 36028797018963968 23 0080000000000000 36028797018963967 40 007fffffffffffff 281474976710656 32 0001000000000000 281474976710655 19 0000ffffffffffff 140737488355328 34 0000800000000000 140737488355327 38 00007fffffffffff 1099511627776 8 0000010000000000 1099511627775 20 000000ffffffffff 549755813888 35 0000008000000000 549755813887 1 0000007fffffffff 4294967296 11 0000000100000000 4294967295 37 00000000ffffffff 2147483648 36 0000000080000000 2147483647 46 000000007fffffff 16777216 15 0000000001000000 16777215 9 0000000000ffffff 8388608 5 0000000000800000 8388607 7 00000000007fffff 65536 33 0000000000010000 65535 6 000000000000ffff 32768 22 0000000000008000 32767 10 0000000000007fff 256 14 0000000000000100 255 29 00000000000000ff 128 41 0000000000000080 127 25 000000000000007f 0 3 0000000000000000 -1 17 ffffffffffffffff -128 45 ffffffffffffff80 -129 4 ffffffffffffff7f -32768 42 ffffffffffff8000 -32769 24 ffffffffffff7fff -8388608 2 ffffffffff800000 -8388609 21 ffffffffff7fffff -2147483648 31 ffffffff80000000 -2147483649 39 ffffffff7fffffff -549755813888 12 ffffff8000000000 -549755813889 28 ffffff7fffffffff -140737488355328 13 ffff800000000000 -140737488355329 44 ffff7fffffffffff -36028797018963968 43 ff80000000000000 -36028797018963969 30 ff7fffffffffffff -9223372036854775808 26 8000000000000000}
do_test boundary4-3.7 {
  db eval {
    SELECT rowid, a, x FROM t1 ORDER BY +a
  }
} {549755813887 1 0000007fffffffff -8388608 2 ffffffffff800000 0 3 0000000000000000 -129 4 ffffffffffffff7f 8388608 5 0000000000800000 65535 6 000000000000ffff 8388607 7 00000000007fffff 1099511627776 8 0000010000000000 16777215 9 0000000000ffffff 32767 10 0000000000007fff 4294967296 11 0000000100000000 -549755813888 12 ffffff8000000000 -140737488355328 13 ffff800000000000 256 14 0000000000000100 16777216 15 0000000001000000 72057594037927936 16 0100000000000000 -1 17 ffffffffffffffff 9223372036854775807 18 7fffffffffffffff 281474976710655 19 0000ffffffffffff 1099511627775 20 000000ffffffffff -8388609 21 ffffffffff7fffff 32768 22 0000000000008000 36028797018963968 23 0080000000000000 -32769 24 ffffffffffff7fff 127 25 000000000000007f -9223372036854775808 26 8000000000000000 72057594037927935 27 00ffffffffffffff -549755813889 28 ffffff7fffffffff 255 29 00000000000000ff -36028797018963969 30 ff7fffffffffffff -2147483648 31 ffffffff80000000 281474976710656 32 0001000000000000 65536 33 0000000000010000 140737488355328 34 0000800000000000 549755813888 35 0000008000000000 2147483648 36 0000000080000000 4294967295 37 00000000ffffffff 140737488355327 38 00007fffffffffff -2147483649 39 ffffffff7fffffff 36028797018963967 40 007fffffffffffff 128 41 0000000000000080 -32768 42 ffffffffffff8000 -36028797018963968 43 ff80000000000000 -140737488355329 44 ffff7fffffffffff -128 45 ffffffffffffff80 2147483647 46 000000007fffffff}
do_test boundary4-3.8 {
  db eval {
    SELECT rowid, a, x FROM t1 ORDER BY a
  }
} {549755813887 1 0000007fffffffff -8388608 2 ffffffffff800000 0 3 0000000000000000 -129 4 ffffffffffffff7f 8388608 5 0000000000800000 65535 6 000000000000ffff 8388607 7 00000000007fffff 1099511627776 8 0000010000000000 16777215 9 0000000000ffffff 32767 10 0000000000007fff 4294967296 11 0000000100000000 -549755813888 12 ffffff8000000000 -140737488355328 13 ffff800000000000 256 14 0000000000000100 16777216 15 0000000001000000 72057594037927936 16 0100000000000000 -1 17 ffffffffffffffff 9223372036854775807 18 7fffffffffffffff 281474976710655 19 0000ffffffffffff 1099511627775 20 000000ffffffffff -8388609 21 ffffffffff7fffff 32768 22 0000000000008000 36028797018963968 23 0080000000000000 -32769 24 ffffffffffff7fff 127 25 000000000000007f -9223372036854775808 26 8000000000000000 72057594037927935 27 00ffffffffffffff -549755813889 28 ffffff7fffffffff 255 29 00000000000000ff -36028797018963969 30 ff7fffffffffffff -2147483648 31 ffffffff80000000 281474976710656 32 0001000000000000 65536 33 0000000000010000 140737488355328 34 0000800000000000 549755813888 35 0000008000000000 2147483648 36 0000000080000000 4294967295 37 00000000ffffffff 140737488355327 38 00007fffffffffff -2147483649 39 ffffffff7fffffff 36028797018963967 40 007fffffffffffff 128 41 0000000000000080 -32768 42 ffffffffffff8000 -36028797018963968 43 ff80000000000000 -140737488355329 44 ffff7fffffffffff -128 45 ffffffffffffff80 2147483647 46 000000007fffffff}
do_test boundary4-3.9 {
  db eval {
    SELECT rowid, a, x FROM t1 ORDER BY +a DESC
  }
} {2147483647 46 000000007fffffff -128 45 ffffffffffffff80 -140737488355329 44 ffff7fffffffffff -36028797018963968 43 ff80000000000000 -32768 42 ffffffffffff8000 128 41 0000000000000080 36028797018963967 40 007fffffffffffff -2147483649 39 ffffffff7fffffff 140737488355327 38 00007fffffffffff 4294967295 37 00000000ffffffff 2147483648 36 0000000080000000 549755813888 35 0000008000000000 140737488355328 34 0000800000000000 65536 33 0000000000010000 281474976710656 32 0001000000000000 -2147483648 31 ffffffff80000000 -36028797018963969 30 ff7fffffffffffff 255 29 00000000000000ff -549755813889 28 ffffff7fffffffff 72057594037927935 27 00ffffffffffffff -9223372036854775808 26 8000000000000000 127 25 000000000000007f -32769 24 ffffffffffff7fff 36028797018963968 23 0080000000000000 32768 22 0000000000008000 -8388609 21 ffffffffff7fffff 1099511627775 20 000000ffffffffff 281474976710655 19 0000ffffffffffff 9223372036854775807 18 7fffffffffffffff -1 17 ffffffffffffffff 72057594037927936 16 0100000000000000 16777216 15 0000000001000000 256 14 0000000000000100 -140737488355328 13 ffff800000000000 -549755813888 12 ffffff8000000000 4294967296 11 0000000100000000 32767 10 0000000000007fff 16777215 9 0000000000ffffff 1099511627776 8 0000010000000000 8388607 7 00000000007fffff 65535 6 000000000000ffff 8388608 5 0000000000800000 -129 4 ffffffffffffff7f 0 3 0000000000000000 -8388608 2 ffffffffff800000 549755813887 1 0000007fffffffff}
do_test boundary4-3.10 {
  db eval {
    SELECT rowid, a, x FROM t1 ORDER BY a DESC
  }
} {2147483647 46 000000007fffffff -128 45 ffffffffffffff80 -140737488355329 44 ffff7fffffffffff -36028797018963968 43 ff80000000000000 -32768 42 ffffffffffff8000 128 41 0000000000000080 36028797018963967 40 007fffffffffffff -2147483649 39 ffffffff7fffffff 140737488355327 38 00007fffffffffff 4294967295 37 00000000ffffffff 2147483648 36 0000000080000000 549755813888 35 0000008000000000 140737488355328 34 0000800000000000 65536 33 0000000000010000 281474976710656 32 0001000000000000 -2147483648 31 ffffffff80000000 -36028797018963969 30 ff7fffffffffffff 255 29 00000000000000ff -549755813889 28 ffffff7fffffffff 72057594037927935 27 00ffffffffffffff -9223372036854775808 26 8000000000000000 127 25 000000000000007f -32769 24 ffffffffffff7fff 36028797018963968 23 0080000000000000 32768 22 0000000000008000 -8388609 21 ffffffffff7fffff 1099511627775 20 000000ffffffffff 281474976710655 19 0000ffffffffffff 9223372036854775807 18 7fffffffffffffff -1 17 ffffffffffffffff 72057594037927936 16 0100000000000000 16777216 15 0000000001000000 256 14 0000000000000100 -140737488355328 13 ffff800000000000 -549755813888 12 ffffff8000000000 4294967296 11 0000000100000000 32767 10 0000000000007fff 16777215 9 0000000000ffffff 1099511627776 8 0000010000000000 8388607 7 00000000007fffff 65535 6 000000000000ffff 8388608 5 0000000000800000 -129 4 ffffffffffffff7f 0 3 0000000000000000 -8388608 2 ffffffffff800000 549755813887 1 0000007fffffffff}
do_test boundary4-3.11 {
  db eval {
    SELECT rowid, a, x FROM t1 ORDER BY +x
  }
} {0 3 0000000000000000 127 25 000000000000007f 128 41 0000000000000080 255 29 00000000000000ff 256 14 0000000000000100 32767 10 0000000000007fff 32768 22 0000000000008000 65535 6 000000000000ffff 65536 33 0000000000010000 8388607 7 00000000007fffff 8388608 5 0000000000800000 16777215 9 0000000000ffffff 16777216 15 0000000001000000 2147483647 46 000000007fffffff 2147483648 36 0000000080000000 4294967295 37 00000000ffffffff 4294967296 11 0000000100000000 549755813887 1 0000007fffffffff 549755813888 35 0000008000000000 1099511627775 20 000000ffffffffff 1099511627776 8 0000010000000000 140737488355327 38 00007fffffffffff 140737488355328 34 0000800000000000 281474976710655 19 0000ffffffffffff 281474976710656 32 0001000000000000 36028797018963967 40 007fffffffffffff 36028797018963968 23 0080000000000000 72057594037927935 27 00ffffffffffffff 72057594037927936 16 0100000000000000 9223372036854775807 18 7fffffffffffffff -9223372036854775808 26 8000000000000000 -36028797018963969 30 ff7fffffffffffff -36028797018963968 43 ff80000000000000 -140737488355329 44 ffff7fffffffffff -140737488355328 13 ffff800000000000 -549755813889 28 ffffff7fffffffff -549755813888 12 ffffff8000000000 -2147483649 39 ffffffff7fffffff -2147483648 31 ffffffff80000000 -8388609 21 ffffffffff7fffff -8388608 2 ffffffffff800000 -32769 24 ffffffffffff7fff -32768 42 ffffffffffff8000 -129 4 ffffffffffffff7f -128 45 ffffffffffffff80 -1 17 ffffffffffffffff}
do_test boundary4-3.12 {
  db eval {
    SELECT rowid, a, x FROM t1 ORDER BY x
  }
} {0 3 0000000000000000 127 25 000000000000007f 128 41 0000000000000080 255 29 00000000000000ff 256 14 0000000000000100 32767 10 0000000000007fff 32768 22 0000000000008000 65535 6 000000000000ffff 65536 33 0000000000010000 8388607 7 00000000007fffff 8388608 5 0000000000800000 16777215 9 0000000000ffffff 16777216 15 0000000001000000 2147483647 46 000000007fffffff 2147483648 36 0000000080000000 4294967295 37 00000000ffffffff 4294967296 11 0000000100000000 549755813887 1 0000007fffffffff 549755813888 35 0000008000000000 1099511627775 20 000000ffffffffff 1099511627776 8 0000010000000000 140737488355327 38 00007fffffffffff 140737488355328 34 0000800000000000 281474976710655 19 0000ffffffffffff 281474976710656 32 0001000000000000 36028797018963967 40 007fffffffffffff 36028797018963968 23 0080000000000000 72057594037927935 27 00ffffffffffffff 72057594037927936 16 0100000000000000 9223372036854775807 18 7fffffffffffffff -9223372036854775808 26 8000000000000000 -36028797018963969 30 ff7fffffffffffff -36028797018963968 43 ff80000000000000 -140737488355329 44 ffff7fffffffffff -140737488355328 13 ffff800000000000 -549755813889 28 ffffff7fffffffff -549755813888 12 ffffff8000000000 -2147483649 39 ffffffff7fffffff -2147483648 31 ffffffff80000000 -8388609 21 ffffffffff7fffff -8388608 2 ffffffffff800000 -32769 24 ffffffffffff7fff -32768 42 ffffffffffff8000 -129 4 ffffffffffffff7f -128 45 ffffffffffffff80 -1 17 ffffffffffffffff}
do_test boundary4-3.13 {
  db eval {
    SELECT rowid, a, x FROM t1 ORDER BY +x DESC
  }
} {-1 17 ffffffffffffffff -128 45 ffffffffffffff80 -129 4 ffffffffffffff7f -32768 42 ffffffffffff8000 -32769 24 ffffffffffff7fff -8388608 2 ffffffffff800000 -8388609 21 ffffffffff7fffff -2147483648 31 ffffffff80000000 -2147483649 39 ffffffff7fffffff -549755813888 12 ffffff8000000000 -549755813889 28 ffffff7fffffffff -140737488355328 13 ffff800000000000 -140737488355329 44 ffff7fffffffffff -36028797018963968 43 ff80000000000000 -36028797018963969 30 ff7fffffffffffff -9223372036854775808 26 8000000000000000 9223372036854775807 18 7fffffffffffffff 72057594037927936 16 0100000000000000 72057594037927935 27 00ffffffffffffff 36028797018963968 23 0080000000000000 36028797018963967 40 007fffffffffffff 281474976710656 32 0001000000000000 281474976710655 19 0000ffffffffffff 140737488355328 34 0000800000000000 140737488355327 38 00007fffffffffff 1099511627776 8 0000010000000000 1099511627775 20 000000ffffffffff 549755813888 35 0000008000000000 549755813887 1 0000007fffffffff 4294967296 11 0000000100000000 4294967295 37 00000000ffffffff 2147483648 36 0000000080000000 2147483647 46 000000007fffffff 16777216 15 0000000001000000 16777215 9 0000000000ffffff 8388608 5 0000000000800000 8388607 7 00000000007fffff 65536 33 0000000000010000 65535 6 000000000000ffff 32768 22 0000000000008000 32767 10 0000000000007fff 256 14 0000000000000100 255 29 00000000000000ff 128 41 0000000000000080 127 25 000000000000007f 0 3 0000000000000000}
do_test boundary4-3.14 {
  db eval {
    SELECT rowid, a, x FROM t1 ORDER BY x DESC
  }
} {-1 17 ffffffffffffffff -128 45 ffffffffffffff80 -129 4 ffffffffffffff7f -32768 42 ffffffffffff8000 -32769 24 ffffffffffff7fff -8388608 2 ffffffffff800000 -8388609 21 ffffffffff7fffff -2147483648 31 ffffffff80000000 -2147483649 39 ffffffff7fffffff -549755813888 12 ffffff8000000000 -549755813889 28 ffffff7fffffffff -140737488355328 13 ffff800000000000 -140737488355329 44 ffff7fffffffffff -36028797018963968 43 ff80000000000000 -36028797018963969 30 ff7fffffffffffff -9223372036854775808 26 8000000000000000 9223372036854775807 18 7fffffffffffffff 72057594037927936 16 0100000000000000 72057594037927935 27 00ffffffffffffff 36028797018963968 23 0080000000000000 36028797018963967 40 007fffffffffffff 281474976710656 32 0001000000000000 281474976710655 19 0000ffffffffffff 140737488355328 34 0000800000000000 140737488355327 38 00007fffffffffff 1099511627776 8 0000010000000000 1099511627775 20 000000ffffffffff 549755813888 35 0000008000000000 549755813887 1 0000007fffffffff 4294967296 11 0000000100000000 4294967295 37 00000000ffffffff 2147483648 36 0000000080000000 2147483647 46 000000007fffffff 16777216 15 0000000001000000 16777215 9 0000000000ffffff 8388608 5 0000000000800000 8388607 7 00000000007fffff 65536 33 0000000000010000 65535 6 000000000000ffff 32768 22 0000000000008000 32767 10 0000000000007fff 256 14 0000000000000100 255 29 00000000000000ff 128 41 0000000000000080 127 25 000000000000007f 0 3 0000000000000000}
do_test boundary4-4.1 {
  db eval {
    UPDATE t1 SET rowid=a, a=rowid, x=z, z=x
  }
} {}
do_test boundary4-4.3 {
  db eval {
    SELECT a, rowid, z FROM t1 ORDER BY +a
  }
} {-9223372036854775808 26 8000000000000000 -36028797018963969 30 ff7fffffffffffff -36028797018963968 43 ff80000000000000 -140737488355329 44 ffff7fffffffffff -140737488355328 13 ffff800000000000 -549755813889 28 ffffff7fffffffff -549755813888 12 ffffff8000000000 -2147483649 39 ffffffff7fffffff -2147483648 31 ffffffff80000000 -8388609 21 ffffffffff7fffff -8388608 2 ffffffffff800000 -32769 24 ffffffffffff7fff -32768 42 ffffffffffff8000 -129 4 ffffffffffffff7f -128 45 ffffffffffffff80 -1 17 ffffffffffffffff 0 3 0000000000000000 127 25 000000000000007f 128 41 0000000000000080 255 29 00000000000000ff 256 14 0000000000000100 32767 10 0000000000007fff 32768 22 0000000000008000 65535 6 000000000000ffff 65536 33 0000000000010000 8388607 7 00000000007fffff 8388608 5 0000000000800000 16777215 9 0000000000ffffff 16777216 15 0000000001000000 2147483647 46 000000007fffffff 2147483648 36 0000000080000000 4294967295 37 00000000ffffffff 4294967296 11 0000000100000000 549755813887 1 0000007fffffffff 549755813888 35 0000008000000000 1099511627775 20 000000ffffffffff 1099511627776 8 0000010000000000 140737488355327 38 00007fffffffffff 140737488355328 34 0000800000000000 281474976710655 19 0000ffffffffffff 281474976710656 32 0001000000000000 36028797018963967 40 007fffffffffffff 36028797018963968 23 0080000000000000 72057594037927935 27 00ffffffffffffff 72057594037927936 16 0100000000000000 9223372036854775807 18 7fffffffffffffff}
do_test boundary4-4.4 {
  db eval {
    SELECT a, rowid, z FROM t1 ORDER BY a
  }
} {-9223372036854775808 26 8000000000000000 -36028797018963969 30 ff7fffffffffffff -36028797018963968 43 ff80000000000000 -140737488355329 44 ffff7fffffffffff -140737488355328 13 ffff800000000000 -549755813889 28 ffffff7fffffffff -549755813888 12 ffffff8000000000 -2147483649 39 ffffffff7fffffff -2147483648 31 ffffffff80000000 -8388609 21 ffffffffff7fffff -8388608 2 ffffffffff800000 -32769 24 ffffffffffff7fff -32768 42 ffffffffffff8000 -129 4 ffffffffffffff7f -128 45 ffffffffffffff80 -1 17 ffffffffffffffff 0 3 0000000000000000 127 25 000000000000007f 128 41 0000000000000080 255 29 00000000000000ff 256 14 0000000000000100 32767 10 0000000000007fff 32768 22 0000000000008000 65535 6 000000000000ffff 65536 33 0000000000010000 8388607 7 00000000007fffff 8388608 5 0000000000800000 16777215 9 0000000000ffffff 16777216 15 0000000001000000 2147483647 46 000000007fffffff 2147483648 36 0000000080000000 4294967295 37 00000000ffffffff 4294967296 11 0000000100000000 549755813887 1 0000007fffffffff 549755813888 35 0000008000000000 1099511627775 20 000000ffffffffff 1099511627776 8 0000010000000000 140737488355327 38 00007fffffffffff 140737488355328 34 0000800000000000 281474976710655 19 0000ffffffffffff 281474976710656 32 0001000000000000 36028797018963967 40 007fffffffffffff 36028797018963968 23 0080000000000000 72057594037927935 27 00ffffffffffffff 72057594037927936 16 0100000000000000 9223372036854775807 18 7fffffffffffffff}
do_test boundary4-4.5 {
  db eval {
    SELECT a, rowid, z FROM t1 ORDER BY +a DESC
  }
} {9223372036854775807 18 7fffffffffffffff 72057594037927936 16 0100000000000000 72057594037927935 27 00ffffffffffffff 36028797018963968 23 0080000000000000 36028797018963967 40 007fffffffffffff 281474976710656 32 0001000000000000 281474976710655 19 0000ffffffffffff 140737488355328 34 0000800000000000 140737488355327 38 00007fffffffffff 1099511627776 8 0000010000000000 1099511627775 20 000000ffffffffff 549755813888 35 0000008000000000 549755813887 1 0000007fffffffff 4294967296 11 0000000100000000 4294967295 37 00000000ffffffff 2147483648 36 0000000080000000 2147483647 46 000000007fffffff 16777216 15 0000000001000000 16777215 9 0000000000ffffff 8388608 5 0000000000800000 8388607 7 00000000007fffff 65536 33 0000000000010000 65535 6 000000000000ffff 32768 22 0000000000008000 32767 10 0000000000007fff 256 14 0000000000000100 255 29 00000000000000ff 128 41 0000000000000080 127 25 000000000000007f 0 3 0000000000000000 -1 17 ffffffffffffffff -128 45 ffffffffffffff80 -129 4 ffffffffffffff7f -32768 42 ffffffffffff8000 -32769 24 ffffffffffff7fff -8388608 2 ffffffffff800000 -8388609 21 ffffffffff7fffff -2147483648 31 ffffffff80000000 -2147483649 39 ffffffff7fffffff -549755813888 12 ffffff8000000000 -549755813889 28 ffffff7fffffffff -140737488355328 13 ffff800000000000 -140737488355329 44 ffff7fffffffffff -36028797018963968 43 ff80000000000000 -36028797018963969 30 ff7fffffffffffff -9223372036854775808 26 8000000000000000}
do_test boundary4-4.6 {
  db eval {
    SELECT a, rowid, z FROM t1 ORDER BY a DESC
  }
} {9223372036854775807 18 7fffffffffffffff 72057594037927936 16 0100000000000000 72057594037927935 27 00ffffffffffffff 36028797018963968 23 0080000000000000 36028797018963967 40 007fffffffffffff 281474976710656 32 0001000000000000 281474976710655 19 0000ffffffffffff 140737488355328 34 0000800000000000 140737488355327 38 00007fffffffffff 1099511627776 8 0000010000000000 1099511627775 20 000000ffffffffff 549755813888 35 0000008000000000 549755813887 1 0000007fffffffff 4294967296 11 0000000100000000 4294967295 37 00000000ffffffff 2147483648 36 0000000080000000 2147483647 46 000000007fffffff 16777216 15 0000000001000000 16777215 9 0000000000ffffff 8388608 5 0000000000800000 8388607 7 00000000007fffff 65536 33 0000000000010000 65535 6 000000000000ffff 32768 22 0000000000008000 32767 10 0000000000007fff 256 14 0000000000000100 255 29 00000000000000ff 128 41 0000000000000080 127 25 000000000000007f 0 3 0000000000000000 -1 17 ffffffffffffffff -128 45 ffffffffffffff80 -129 4 ffffffffffffff7f -32768 42 ffffffffffff8000 -32769 24 ffffffffffff7fff -8388608 2 ffffffffff800000 -8388609 21 ffffffffff7fffff -2147483648 31 ffffffff80000000 -2147483649 39 ffffffff7fffffff -549755813888 12 ffffff8000000000 -549755813889 28 ffffff7fffffffff -140737488355328 13 ffff800000000000 -140737488355329 44 ffff7fffffffffff -36028797018963968 43 ff80000000000000 -36028797018963969 30 ff7fffffffffffff -9223372036854775808 26 8000000000000000}
do_test boundary4-4.7 {
  db eval {
    SELECT a, rowid, z FROM t1 ORDER BY +rowid
  }
} {549755813887 1 0000007fffffffff -8388608 2 ffffffffff800000 0 3 0000000000000000 -129 4 ffffffffffffff7f 8388608 5 0000000000800000 65535 6 000000000000ffff 8388607 7 00000000007fffff 1099511627776 8 0000010000000000 16777215 9 0000000000ffffff 32767 10 0000000000007fff 4294967296 11 0000000100000000 -549755813888 12 ffffff8000000000 -140737488355328 13 ffff800000000000 256 14 0000000000000100 16777216 15 0000000001000000 72057594037927936 16 0100000000000000 -1 17 ffffffffffffffff 9223372036854775807 18 7fffffffffffffff 281474976710655 19 0000ffffffffffff 1099511627775 20 000000ffffffffff -8388609 21 ffffffffff7fffff 32768 22 0000000000008000 36028797018963968 23 0080000000000000 -32769 24 ffffffffffff7fff 127 25 000000000000007f -9223372036854775808 26 8000000000000000 72057594037927935 27 00ffffffffffffff -549755813889 28 ffffff7fffffffff 255 29 00000000000000ff -36028797018963969 30 ff7fffffffffffff -2147483648 31 ffffffff80000000 281474976710656 32 0001000000000000 65536 33 0000000000010000 140737488355328 34 0000800000000000 549755813888 35 0000008000000000 2147483648 36 0000000080000000 4294967295 37 00000000ffffffff 140737488355327 38 00007fffffffffff -2147483649 39 ffffffff7fffffff 36028797018963967 40 007fffffffffffff 128 41 0000000000000080 -32768 42 ffffffffffff8000 -36028797018963968 43 ff80000000000000 -140737488355329 44 ffff7fffffffffff -128 45 ffffffffffffff80 2147483647 46 000000007fffffff}
do_test boundary4-4.8 {
  db eval {
    SELECT a, rowid, z FROM t1 ORDER BY rowid
  }
} {549755813887 1 0000007fffffffff -8388608 2 ffffffffff800000 0 3 0000000000000000 -129 4 ffffffffffffff7f 8388608 5 0000000000800000 65535 6 000000000000ffff 8388607 7 00000000007fffff 1099511627776 8 0000010000000000 16777215 9 0000000000ffffff 32767 10 0000000000007fff 4294967296 11 0000000100000000 -549755813888 12 ffffff8000000000 -140737488355328 13 ffff800000000000 256 14 0000000000000100 16777216 15 0000000001000000 72057594037927936 16 0100000000000000 -1 17 ffffffffffffffff 9223372036854775807 18 7fffffffffffffff 281474976710655 19 0000ffffffffffff 1099511627775 20 000000ffffffffff -8388609 21 ffffffffff7fffff 32768 22 0000000000008000 36028797018963968 23 0080000000000000 -32769 24 ffffffffffff7fff 127 25 000000000000007f -9223372036854775808 26 8000000000000000 72057594037927935 27 00ffffffffffffff -549755813889 28 ffffff7fffffffff 255 29 00000000000000ff -36028797018963969 30 ff7fffffffffffff -2147483648 31 ffffffff80000000 281474976710656 32 0001000000000000 65536 33 0000000000010000 140737488355328 34 0000800000000000 549755813888 35 0000008000000000 2147483648 36 0000000080000000 4294967295 37 00000000ffffffff 140737488355327 38 00007fffffffffff -2147483649 39 ffffffff7fffffff 36028797018963967 40 007fffffffffffff 128 41 0000000000000080 -32768 42 ffffffffffff8000 -36028797018963968 43 ff80000000000000 -140737488355329 44 ffff7fffffffffff -128 45 ffffffffffffff80 2147483647 46 000000007fffffff}
do_test boundary4-4.9 {
  db eval {
    SELECT a, rowid, z FROM t1 ORDER BY +rowid DESC
  }
} {2147483647 46 000000007fffffff -128 45 ffffffffffffff80 -140737488355329 44 ffff7fffffffffff -36028797018963968 43 ff80000000000000 -32768 42 ffffffffffff8000 128 41 0000000000000080 36028797018963967 40 007fffffffffffff -2147483649 39 ffffffff7fffffff 140737488355327 38 00007fffffffffff 4294967295 37 00000000ffffffff 2147483648 36 0000000080000000 549755813888 35 0000008000000000 140737488355328 34 0000800000000000 65536 33 0000000000010000 281474976710656 32 0001000000000000 -2147483648 31 ffffffff80000000 -36028797018963969 30 ff7fffffffffffff 255 29 00000000000000ff -549755813889 28 ffffff7fffffffff 72057594037927935 27 00ffffffffffffff -9223372036854775808 26 8000000000000000 127 25 000000000000007f -32769 24 ffffffffffff7fff 36028797018963968 23 0080000000000000 32768 22 0000000000008000 -8388609 21 ffffffffff7fffff 1099511627775 20 000000ffffffffff 281474976710655 19 0000ffffffffffff 9223372036854775807 18 7fffffffffffffff -1 17 ffffffffffffffff 72057594037927936 16 0100000000000000 16777216 15 0000000001000000 256 14 0000000000000100 -140737488355328 13 ffff800000000000 -549755813888 12 ffffff8000000000 4294967296 11 0000000100000000 32767 10 0000000000007fff 16777215 9 0000000000ffffff 1099511627776 8 0000010000000000 8388607 7 00000000007fffff 65535 6 000000000000ffff 8388608 5 0000000000800000 -129 4 ffffffffffffff7f 0 3 0000000000000000 -8388608 2 ffffffffff800000 549755813887 1 0000007fffffffff}
do_test boundary4-4.10 {
  db eval {
    SELECT a, rowid, z FROM t1 ORDER BY rowid DESC
  }
} {2147483647 46 000000007fffffff -128 45 ffffffffffffff80 -140737488355329 44 ffff7fffffffffff -36028797018963968 43 ff80000000000000 -32768 42 ffffffffffff8000 128 41 0000000000000080 36028797018963967 40 007fffffffffffff -2147483649 39 ffffffff7fffffff 140737488355327 38 00007fffffffffff 4294967295 37 00000000ffffffff 2147483648 36 0000000080000000 549755813888 35 0000008000000000 140737488355328 34 0000800000000000 65536 33 0000000000010000 281474976710656 32 0001000000000000 -2147483648 31 ffffffff80000000 -36028797018963969 30 ff7fffffffffffff 255 29 00000000000000ff -549755813889 28 ffffff7fffffffff 72057594037927935 27 00ffffffffffffff -9223372036854775808 26 8000000000000000 127 25 000000000000007f -32769 24 ffffffffffff7fff 36028797018963968 23 0080000000000000 32768 22 0000000000008000 -8388609 21 ffffffffff7fffff 1099511627775 20 000000ffffffffff 281474976710655 19 0000ffffffffffff 9223372036854775807 18 7fffffffffffffff -1 17 ffffffffffffffff 72057594037927936 16 0100000000000000 16777216 15 0000000001000000 256 14 0000000000000100 -140737488355328 13 ffff800000000000 -549755813888 12 ffffff8000000000 4294967296 11 0000000100000000 32767 10 0000000000007fff 16777215 9 0000000000ffffff 1099511627776 8 0000010000000000 8388607 7 00000000007fffff 65535 6 000000000000ffff 8388608 5 0000000000800000 -129 4 ffffffffffffff7f 0 3 0000000000000000 -8388608 2 ffffffffff800000 549755813887 1 0000007fffffffff}
do_test boundary4-4.11 {
  db eval {
    SELECT a, rowid, z FROM t1 ORDER BY +z
  }
} {0 3 0000000000000000 127 25 000000000000007f 128 41 0000000000000080 255 29 00000000000000ff 256 14 0000000000000100 32767 10 0000000000007fff 32768 22 0000000000008000 65535 6 000000000000ffff 65536 33 0000000000010000 8388607 7 00000000007fffff 8388608 5 0000000000800000 16777215 9 0000000000ffffff 16777216 15 0000000001000000 2147483647 46 000000007fffffff 2147483648 36 0000000080000000 4294967295 37 00000000ffffffff 4294967296 11 0000000100000000 549755813887 1 0000007fffffffff 549755813888 35 0000008000000000 1099511627775 20 000000ffffffffff 1099511627776 8 0000010000000000 140737488355327 38 00007fffffffffff 140737488355328 34 0000800000000000 281474976710655 19 0000ffffffffffff 281474976710656 32 0001000000000000 36028797018963967 40 007fffffffffffff 36028797018963968 23 0080000000000000 72057594037927935 27 00ffffffffffffff 72057594037927936 16 0100000000000000 9223372036854775807 18 7fffffffffffffff -9223372036854775808 26 8000000000000000 -36028797018963969 30 ff7fffffffffffff -36028797018963968 43 ff80000000000000 -140737488355329 44 ffff7fffffffffff -140737488355328 13 ffff800000000000 -549755813889 28 ffffff7fffffffff -549755813888 12 ffffff8000000000 -2147483649 39 ffffffff7fffffff -2147483648 31 ffffffff80000000 -8388609 21 ffffffffff7fffff -8388608 2 ffffffffff800000 -32769 24 ffffffffffff7fff -32768 42 ffffffffffff8000 -129 4 ffffffffffffff7f -128 45 ffffffffffffff80 -1 17 ffffffffffffffff}
do_test boundary4-4.12 {
  db eval {
    SELECT a, rowid, z FROM t1 ORDER BY z
  }
} {0 3 0000000000000000 127 25 000000000000007f 128 41 0000000000000080 255 29 00000000000000ff 256 14 0000000000000100 32767 10 0000000000007fff 32768 22 0000000000008000 65535 6 000000000000ffff 65536 33 0000000000010000 8388607 7 00000000007fffff 8388608 5 0000000000800000 16777215 9 0000000000ffffff 16777216 15 0000000001000000 2147483647 46 000000007fffffff 2147483648 36 0000000080000000 4294967295 37 00000000ffffffff 4294967296 11 0000000100000000 549755813887 1 0000007fffffffff 549755813888 35 0000008000000000 1099511627775 20 000000ffffffffff 1099511627776 8 0000010000000000 140737488355327 38 00007fffffffffff 140737488355328 34 0000800000000000 281474976710655 19 0000ffffffffffff 281474976710656 32 0001000000000000 36028797018963967 40 007fffffffffffff 36028797018963968 23 0080000000000000 72057594037927935 27 00ffffffffffffff 72057594037927936 16 0100000000000000 9223372036854775807 18 7fffffffffffffff -9223372036854775808 26 8000000000000000 -36028797018963969 30 ff7fffffffffffff -36028797018963968 43 ff80000000000000 -140737488355329 44 ffff7fffffffffff -140737488355328 13 ffff800000000000 -549755813889 28 ffffff7fffffffff -549755813888 12 ffffff8000000000 -2147483649 39 ffffffff7fffffff -2147483648 31 ffffffff80000000 -8388609 21 ffffffffff7fffff -8388608 2 ffffffffff800000 -32769 24 ffffffffffff7fff -32768 42 ffffffffffff8000 -129 4 ffffffffffffff7f -128 45 ffffffffffffff80 -1 17 ffffffffffffffff}
do_test boundary4-4.13 {
  db eval {
    SELECT a, rowid, z FROM t1 ORDER BY +z DESC
  }
} {-1 17 ffffffffffffffff -128 45 ffffffffffffff80 -129 4 ffffffffffffff7f -32768 42 ffffffffffff8000 -32769 24 ffffffffffff7fff -8388608 2 ffffffffff800000 -8388609 21 ffffffffff7fffff -2147483648 31 ffffffff80000000 -2147483649 39 ffffffff7fffffff -549755813888 12 ffffff8000000000 -549755813889 28 ffffff7fffffffff -140737488355328 13 ffff800000000000 -140737488355329 44 ffff7fffffffffff -36028797018963968 43 ff80000000000000 -36028797018963969 30 ff7fffffffffffff -9223372036854775808 26 8000000000000000 9223372036854775807 18 7fffffffffffffff 72057594037927936 16 0100000000000000 72057594037927935 27 00ffffffffffffff 36028797018963968 23 0080000000000000 36028797018963967 40 007fffffffffffff 281474976710656 32 0001000000000000 281474976710655 19 0000ffffffffffff 140737488355328 34 0000800000000000 140737488355327 38 00007fffffffffff 1099511627776 8 0000010000000000 1099511627775 20 000000ffffffffff 549755813888 35 0000008000000000 549755813887 1 0000007fffffffff 4294967296 11 0000000100000000 4294967295 37 00000000ffffffff 2147483648 36 0000000080000000 2147483647 46 000000007fffffff 16777216 15 0000000001000000 16777215 9 0000000000ffffff 8388608 5 0000000000800000 8388607 7 00000000007fffff 65536 33 0000000000010000 65535 6 000000000000ffff 32768 22 0000000000008000 32767 10 0000000000007fff 256 14 0000000000000100 255 29 00000000000000ff 128 41 0000000000000080 127 25 000000000000007f 0 3 0000000000000000}
do_test boundary4-4.14 {
  db eval {
    SELECT a, rowid, z FROM t1 ORDER BY z DESC
  }
} {-1 17 ffffffffffffffff -128 45 ffffffffffffff80 -129 4 ffffffffffffff7f -32768 42 ffffffffffff8000 -32769 24 ffffffffffff7fff -8388608 2 ffffffffff800000 -8388609 21 ffffffffff7fffff -2147483648 31 ffffffff80000000 -2147483649 39 ffffffff7fffffff -549755813888 12 ffffff8000000000 -549755813889 28 ffffff7fffffffff -140737488355328 13 ffff800000000000 -140737488355329 44 ffff7fffffffffff -36028797018963968 43 ff80000000000000 -36028797018963969 30 ff7fffffffffffff -9223372036854775808 26 8000000000000000 9223372036854775807 18 7fffffffffffffff 72057594037927936 16 0100000000000000 72057594037927935 27 00ffffffffffffff 36028797018963968 23 0080000000000000 36028797018963967 40 007fffffffffffff 281474976710656 32 0001000000000000 281474976710655 19 0000ffffffffffff 140737488355328 34 0000800000000000 140737488355327 38 00007fffffffffff 1099511627776 8 0000010000000000 1099511627775 20 000000ffffffffff 549755813888 35 0000008000000000 549755813887 1 0000007fffffffff 4294967296 11 0000000100000000 4294967295 37 00000000ffffffff 2147483648 36 0000000080000000 2147483647 46 000000007fffffff 16777216 15 0000000001000000 16777215 9 0000000000ffffff 8388608 5 0000000000800000 8388607 7 00000000007fffff 65536 33 0000000000010000 65535 6 000000000000ffff 32768 22 0000000000008000 32767 10 0000000000007fff 256 14 0000000000000100 255 29 00000000000000ff 128 41 0000000000000080 127 25 000000000000007f 0 3 0000000000000000}
finish_test
